Título,Precio,Metros_cuadrados,Habitaciones,Barrio,url_detalle
"Piso en Calle de San Dacio, 9, Tres Olivos - Valverde, Madrid",300.000€,60,3 hab.,Tres Olivos - Valverde,https://www.idealista.com/inmueble/109393744/
"Piso en Valdeacederas, Madrid",389.000€,67,3 hab.,Piso en Valdeacederas,https://www.idealista.com/inmueble/109531024/
"Piso en Calle de las Azucenas, Valdeacederas, Madrid",285.000€,93,2 hab.,Valdeacederas,https://www.idealista.com/inmueble/109794236/
"Piso en Tres Olivos - Valverde, Madrid",339.000€,105,3 hab.,Piso en Tres Olivos - Valverde,https://www.idealista.com/inmueble/109725735/
"Piso en Calle de Sandalio López, Tres Olivos - Valverde, Madrid",204.900€,55,3 hab.,Tres Olivos - Valverde,https://www.idealista.com/inmueble/109629837/
"Piso en Calle del Plátano, Valdeacederas, Madrid",342.500€,81,3 hab.,Valdeacederas,https://www.idealista.com/inmueble/109290181/
"Piso en Ventilla-Almenara, Madrid",350.000€,103,3 hab.,Piso en Ventilla-Almenara,https://www.idealista.com/inmueble/108174078/
"Piso en Calle Manuela Mínguez, Valdeacederas, Madrid",239.900€,54,2 hab.,Valdeacederas,https://www.idealista.com/inmueble/109783444/
"Piso en Berruguete, Madrid",305.000€,62,2 hab.,Piso en Berruguete,https://www.idealista.com/inmueble/109458251/
"Piso en Tres Olivos - Valverde, Madrid",320.000€,65,3 hab.,Piso en Tres Olivos - Valverde,https://www.idealista.com/inmueble/108746991/
"Piso en Calle de Rosario Romero, Ventilla-Almenara, Madrid",289.900€,56,3 hab.,Ventilla-Almenara,https://www.idealista.com/inmueble/109262963/
"Piso en Paseo de la Dirección, 358, Valdeacederas, Madrid",365.000€,64,3 hab.,Valdeacederas,https://www.idealista.com/inmueble/108263690/
"Piso en Calle de Isidro Fernández, Tres Olivos - Valverde, Madrid",202.000€,53,2 hab.,Tres Olivos - Valverde,https://www.idealista.com/inmueble/109199296/
"Dúplex en Calle del Divino Redentor, 32, Valdeacederas, Madrid",299.000€,127,2 hab.,Valdeacederas,https://www.idealista.com/inmueble/109656250/
"Piso en Calle de Pinos Baja, Valdeacederas, Madrid",315.000€,93,2 hab.,Valdeacederas,https://www.idealista.com/inmueble/109707639/
"Piso en CL Gonzalo Herrero, 12, Valdeacederas, Madrid",395.000€,79,2 hab.,Valdeacederas,https://www.idealista.com/inmueble/109119697/
"Piso en Calle del Aligustre, Valdeacederas, Madrid",329.900€,64,3 hab.,Valdeacederas,https://www.idealista.com/inmueble/108318380/
"Piso en Calle del Arroyo, Valdeacederas, Madrid",350.000€,95,3 hab.,Valdeacederas,https://www.idealista.com/inmueble/109464016/
"Piso en Calle de las Gardenias, Valdeacederas, Madrid",295.000€,156,3 hab.,Valdeacederas,https://www.idealista.com/inmueble/109335221/
"Piso en Valdeacederas, Madrid",349.900€,91,3 hab.,Piso en Valdeacederas,https://www.idealista.com/inmueble/109317910/
"Piso en Calle Sorgo, Valdeacederas, Madrid",315.000€,59,2 hab.,Valdeacederas,https://www.idealista.com/inmueble/109244673/
"Piso en Calle de José Anduiza, 6, La Paz, Madrid",285.000€,53,2 hab.,La Paz,https://www.idealista.com/inmueble/109809331/
"Piso en Calle del Arroyo, Valdeacederas, Madrid",170.000€,60,2 hab.,Valdeacederas,https://www.idealista.com/inmueble/108384358/
"Piso en Calle de Tablada, Berruguete, Madrid",283.200€,60,3 hab.,Berruguete,https://www.idealista.com/inmueble/109561123/
"Piso en Calle de Francisca Calonge, Valdeacederas, Madrid",297.500€,79,2 hab.,Valdeacederas,https://www.idealista.com/inmueble/109713920/
"Ático en Calle del Capitán Blanco Argibay, Valdeacederas, Madrid",310.000€,70,2 hab.,Valdeacederas,https://www.idealista.com/inmueble/108225774/
"Piso en Valdeacederas, Madrid",310.000€,70,3 hab.,Piso en Valdeacederas,https://www.idealista.com/inmueble/109577466/
"Piso en Calle de San Dacio, 20, Tres Olivos - Valverde, Madrid",280.000€,70,2 hab.,Tres Olivos - Valverde,https://www.idealista.com/inmueble/109791705/
"Chalet pareado en Tres Olivos - Valverde, Madrid",375.000€,86,3 hab.,Chalet pareado en Tres Olivos - Valverde,https://www.idealista.com/inmueble/107192213/
"Piso en Ventilla-Almenara, Madrid",298.000€,60,2 hab.,Piso en Ventilla-Almenara,https://www.idealista.com/inmueble/109151140/
"Piso en Ventilla-Almenara, Madrid",349.000€,75,3 hab.,Piso en Ventilla-Almenara,https://www.idealista.com/inmueble/108844627/
"Piso en Ventilla-Almenara, Madrid",255.000€,48,2 hab.,Piso en Ventilla-Almenara,https://www.idealista.com/inmueble/109801231/
"Piso en Calle de Núñez Morgado, 4, Castilla, Madrid",325.000€,78,3 hab.,Castilla,https://www.idealista.com/inmueble/108949663/
"Piso en Calle de Marcos de Orueta, 15, Tres Olivos - Valverde, Madrid",254.900€,62,3 hab.,Tres Olivos - Valverde,https://www.idealista.com/inmueble/109696187/
"Piso en Tres Olivos - Valverde, Madrid",309.000€,85,3 hab.,Piso en Tres Olivos - Valverde,https://www.idealista.com/inmueble/109128181/
"Piso en Paseo de la Dirección, 316, Valdeacederas, Madrid",280.000€,56,2 hab.,Valdeacederas,https://www.idealista.com/inmueble/109414173/
"Piso en Calle Carmen Montoya, Ventilla-Almenara, Madrid",349.500€,81,3 hab.,Ventilla-Almenara,https://www.idealista.com/inmueble/108352902/
"Piso en Calle de la Alfalfa, 39, Valdeacederas, Madrid",379.000€,84,2 hab.,Valdeacederas,https://www.idealista.com/inmueble/109686478/
"Piso en Calle de la Alfalfa, 39, Valdeacederas, Madrid",329.000€,76,2 hab.,Valdeacederas,https://www.idealista.com/inmueble/109686476/
"Piso en Calle de Baracaldo, Ventilla-Almenara, Madrid",360.000€,85,2 hab.,Ventilla-Almenara,https://www.idealista.com/inmueble/108553746/
"Piso en Calle de Matilde Landa, Ventilla-Almenara, Madrid",390.000€,76,2 hab.,Ventilla-Almenara,https://www.idealista.com/inmueble/107942425/
"Piso en Calle de Manresa, Tres Olivos - Valverde, Madrid",310.000€,88,3 hab.,Tres Olivos - Valverde,https://www.idealista.com/inmueble/109609129/
"Piso en Calle de Baracaldo, Ventilla-Almenara, Madrid",300.000€,71,3 hab.,Ventilla-Almenara,https://www.idealista.com/inmueble/109776960/
"Piso en Valdeacederas, Madrid",231.000€,48,2 hab.,Piso en Valdeacederas,https://www.idealista.com/inmueble/108396418/
"Piso en Berruguete, Madrid",335.500€,71,3 hab.,Piso en Berruguete,https://www.idealista.com/inmueble/108446186/
"Piso en Ventilla-Almenara, Madrid",264.000€,63,2 hab.,Piso en Ventilla-Almenara,https://www.idealista.com/inmueble/108445794/
"Piso en Valdeacederas, Madrid",264.000€,58,2 hab.,Piso en Valdeacederas,https://www.idealista.com/inmueble/109382656/
"Piso en Calle Cenicientos, Berruguete, Madrid",389.000€,75,3 hab.,Berruguete,https://www.idealista.com/inmueble/109777481/
"Piso en Calle de San Modesto, Tres Olivos - Valverde, Madrid",290.000€,72,3 hab.,Tres Olivos - Valverde,https://www.idealista.com/inmueble/109660528/
"Piso en Calle de Rosa de Silva, Cuzco-Castillejos, Madrid",245.000€,45,2 hab.,Cuzco-Castillejos,https://www.idealista.com/inmueble/108743108/
"Dúplex en Calle de Cuevas, 25, Valdeacederas, Madrid",380.000€,64,3 hab.,Valdeacederas,https://www.idealista.com/inmueble/109785036/
"Piso en Calle Isidro Fernández, 2, Tres Olivos - Valverde, Madrid",315.000€,72,3 hab.,Tres Olivos - Valverde,https://www.idealista.com/inmueble/108125301/
"Piso en Calle de Cuevas, Valdeacederas, Madrid",225.000€,41,2 hab.,Valdeacederas,https://www.idealista.com/inmueble/109722760/
"Piso en CL Aligustre, Valdeacederas, Madrid",399.000€,90,4 hab.,Valdeacederas,https://www.idealista.com/inmueble/109770611/
"Piso en Tres Olivos - Valverde, Madrid",255.000€,70,3 hab.,Piso en Tres Olivos - Valverde,https://www.idealista.com/inmueble/109761134/
"Dúplex en Valdeacederas, Madrid",205.000€,45,2 hab.,Dúplex en Valdeacederas,https://www.idealista.com/inmueble/109068131/
"Dúplex en Calle de Manuel Tovar, 21, Tres Olivos - Valverde, Madrid",330.000€,65,2 hab.,Tres Olivos - Valverde,https://www.idealista.com/inmueble/109296007/
"Piso en Calle de la Ladera, Valdeacederas, Madrid",340.000€,73,3 hab.,Valdeacederas,https://www.idealista.com/inmueble/109689787/
"Piso en Valdeacederas, Madrid",273.500€,51,2 hab.,Piso en Valdeacederas,https://www.idealista.com/inmueble/109732403/
"Piso en Valdeacederas, Madrid",362.000€,72,3 hab.,Piso en Valdeacederas,https://www.idealista.com/inmueble/108545875/
